{
  "DaxOptimizer": {
    "ObfuscateVpax": false
  },
  "AppVersion": "3.25.0",
  "Version": 3,
  "Deployment": {
    "DeployDataSources": true,
    "DeployPartitions": true,
    "DeployRefreshPolicyPartitions": true,
    "DeployModelRoles": true,
    "DeployModelRoleMembers": false,
    "DeploySharedExpressions": true
  },
  "Defaults": {
    "NewModelCL": 1571,
    "UseLatestDefault": true,
    "NewModelUseWorkspace": true
  },
  "DataBrowsing": {
    "AutoRefreshDataPreview": false,
    "AutoRefreshPivotGrid": true,
    "PivotCustomizationShowAllFields": true,
    "PivotHeaderWordWrap": true,
    "WarnIfPivotGridFieldsMismatch": true,
    "AlwaysShowPivotGridFieldList": true,
    "PivotCustomizationDefaultLayout": "BottomPanelOnly2by2",
    "AutoExecuteDaxQuery": false,
    "DirectQueryMaxRows": 100,
    "DaxQueryMaxRows": 1000,
    "DaxQuerySmartSelection": true,
    "KeepFilteringAndSortingDaxQuery": "WhenQueryUnchanged"
  },
  "PbiEndpointBaseUrl": "https://api.powerbi.com",
  "FabricEndpointBaseUrl": "https://api.fabric.microsoft.com",
  "PbiDefaultAuthMode": "Integrated",
  "DefaultSaveMode": "TMDL",
  "DaxFormatterRequestTimeout": 5000,
  "DaxFormatterConsent": false,
  "CheckForUpdatesOnStartup": true,
  "CheckForUpdatesMajorOnly": false,
  "VertiPaqAnalyzerIncludeTom": true,
  "VertiPaqAnalyzerReadStatsFromData": true,
  "VertiPaqAnalyzerDirectLakeExtractionMode": "Full",
  "VertiPaqAnalyzerReadStatsFromDQ": false,
  "VertiPaqAnalyzerSampleRI": 3,
  "VertiPaqAnalyzerColumnBatchSize": 50,
  "CollectTelemetry": false,
  "FormulaFixup": true,
  "FormulaFixupOnPaste": true,
  "PbiModelsAddDaxLineBreak": true,
  "PbiModelsAddDaxLineBreakMultiLineOnly": false,
  "AllowUnsupportedPBIFeatures": false,
  "HidePBIAutoDateTimeWarnings": false,
  "WarnWhenMetadataOutOfSync": true,
  "ChangeDetectionOnLocalServers": true,
  "AutoRefreshTomTree": true,
  "BackgroundBpa": true,
  "BuiltInBpaRules": "Enable",
  "DisabledBuiltInRuleIds": [
    "TE3_BUILT_IN_DATA_COLUMN_SOURCE",
    "TE3_BUILT_IN_EXPRESSION_REQUIRED",
    "TE3_BUILT_IN_AVOID_PROVIDER_PARTITIONS_STRUCTURED",
    "TE3_BUILT_IN_SET_ISAVAILABLEINMDX_FALSE",
    "TE3_BUILT_IN_DATE_TABLE_EXISTS",
    "TE3_BUILT_IN_MANY_TO_MANY_SINGLE_DIRECTION",
    "TE3_BUILT_IN_RELATIONSHIP_SAME_DATATYPE",
    "TE3_BUILT_IN_AVOID_INVALID_CHARACTERS_NAMES",
    "TE3_BUILT_IN_AVOID_INVALID_CHARACTERS_DESCRIPTIONS",
    "TE3_BUILT_IN_SET_ISAVAILABLEINMDX_TRUE_NECESSARY",
    "TE3_BUILT_IN_REMOVE_UNUSED_DATA_SOURCES",
    "TE3_BUILT_IN_VISIBLE_TABLES_NO_DESCRIPTION",
    "TE3_BUILT_IN_VISIBLE_COLUMNS_NO_DESCRIPTION",
    "TE3_BUILT_IN_VISIBLE_MEASURES_NO_DESCRIPTION",
    "TE3_BUILT_IN_VISIBLE_CALCULATION_GROUPS_NO_DESCRIPTION",
    "TE3_BUILT_IN_VISIBLE_UDF_NO_DESCRIPTION",
    "TE3_BUILT_IN_PERSPECTIVES_NO_OBJECTS",
    "TE3_BUILT_IN_CALCULATION_GROUPS_NO_ITEMS",
    "TE3_BUILT_IN_TRIM_OBJECT_NAMES",
    "TE3_BUILT_IN_FORMAT_STRING_COLUMNS",
    "TE3_BUILT_IN_TRANSLATE_DISPLAY_FOLDERS",
    "TE3_BUILT_IN_TRANSLATE_DESCRIPTIONS",
    "TE3_BUILT_IN_TRANSLATE_VISIBLE_NAMES",
    "TE3_BUILT_IN_TRANSLATE_HIERARCHY_LEVELS",
    "TE3_BUILT_IN_TRANSLATE_PERSPECTIVES",
    "TE3_BUILT_IN_SPECIFY_APPLICATION_NAME",
    "TE3_BUILT_IN_POWERBI_LATEST_COMPATIBILITY"
  ],
  "DataRefreshNotification": true,
  "SaveBackupLocation": "",
  "AnnotateDeploymentMetadata": true,
  "SendErrorReports": false,
  "SchemaCompare_IgnoreImport": false,
  "SchemaCompare_IgnoreDataTypeChanges": false,
  "SchemaCompare_IgnoreDescriptionChanges": false,
  "SchemaCompare_IgnoreDecimalToDoubleChanges": false,
  "DirectLake_AutoRefreshSave": true,
  "PrioritizeAnalysisServicesSchemaDetector": true,
  "IgnoreLineageTags": false,
  "IgnoreInferredObjects": true,
  "IgnoreInferredProperties": true,
  "IgnoreTimestamps": true,
  "IgnorePrivacySettings": false,
  "IncludeSensitive": false,
  "IgnoreIncrementalRefreshPartitions": false,
  "SplitMultilineStrings": true,
  "SortArrays": false,
  "UsePbixFileNameWhenSavingToDisk": true,
  "CreateUserOptionsForNewModels": true,
  "ProxyType": "None",
  "ProxyBypassList": "",
  "ProxyUseDefaultCredentials": true,
  "ProxyAddress": "",
  "ProxyBypassOnLocal": true,
  "ProxyUser": "",
  "ProxyPasswordEncrypted": "",
  "SaveToFolder_PrefixFiles": false,
  "SaveToFolder_LocalRelationships": false,
  "SaveToFolder_LocalPerspectives": false,
  "SaveToFolder_LocalTranslations": false,
  "SaveToFolder_UseRecommendedSettings": false,
  "Copy_IncludeTranslations": false,
  "Copy_IncludePerspectives": true,
  "Copy_IncludeRLS": true,
  "Copy_IncludeOLS": true,
  "Perspectives_InheritForNewObjects": true,
  "Perspectives_InheritForRelocatedObjects": true,
  "Perspectives_InheritTableAdd": true,
  "Perspectives_InheritTableRemove": true,
  "View_DisplayFolders": true,
  "View_HiddenObjects": true,
  "View_AllObjectTypes": true,
  "View_SortAlphabetically": false,
  "View_Measures": true,
  "View_Columns": true,
  "View_Hierarchies": true,
  "View_Partitions": true,
  "View_MetadataInformation": true,
  "SaveToFolder_Levels": [
    "Data Sources",
    "Shared Expressions",
    "Perspectives",
    "Relationships",
    "Roles",
    "Tables",
    "Tables/Columns",
    "Tables/Hierarchies",
    "Tables/Measures",
    "Tables/Partitions",
    "Tables/CalculationItems",
    "Translations"
  ],
  "SaveToFolder_UseTmdl": true,
  "TmdlOptions": {
    "IncludeRefs": false,
    "CasingStyle": "CamelCase",
    "ExpressionTrimStyle": "TrimTrailingWhitespaces",
    "NewLineStyle": "SystemDefault",
    "Encoding": "UTF8",
    "BaseIndentationLevel": 0,
    "SpacesIndentation": 0
  },
  "View_ColumnPreferences": [
    {
      "Name": "Name",
      "Width": 355,
      "Visible": true
    },
    {
      "Name": "Parent",
      "Width": 100,
      "Visible": true
    },
    {
      "Name": "Type",
      "Width": 152,
      "Visible": true
    },
    {
      "Name": "Format",
      "Width": 50,
      "Visible": true
    },
    {
      "Name": "Data type",
      "Width": 60,
      "Visible": true
    },
    {
      "Name": "Source",
      "Width": 100,
      "Visible": true
    },
    {
      "Name": "Description",
      "Width": 100,
      "Visible": true
    }
  ],
  "BackupOnSave": false,
  "ShouldBackupOnSave": false,
  "BackupOnDeploy": true,
  "ShouldBackupOnDeploy": false
}